	context	monotonicity	determiner	replace_target	replace_source	replace_mode	label
22914	There seems to be some genetic problem with this x .	up					
22558	I wrote some poems last x .	up					
22597	Tom gave Mary some good x .	up					
23321	Tom bought some x .	up					
18678	There are some cookies under the x .	up					
18983	I think tx has been some misunderstanding x .	up					
17924	Each of the three boys won a x .	up					
20070	We are thinking of buying some new x .	up					
23114	El-Nashar was detained July 14 in Cairo after Britain notified Egyptian authorities that it suspected he may have had links to some of the x .	up					
18985	There were some x there .	up					
20245	I bought some x on the way home from work .	up					
23203	He was very thirsty and asked for some x .	up					
20073	We are thinking of buying some new x .	up					
20984	Tom bought some x for Mary .	up					
20329	Tom and I have some unfinished x .	up					
23952	Tom picked some x and ate them .	up					
21281	Tom bought some x for Mary .	up					
20667	Tom bought some apples and made apple x .	up					
21806	Brian took some x .	up					
24366	There are some x in the room .	up					
17910	The explanation of each fact took a long x .	up					
24386	There are some x in the room .	up					
20721	Tom bought some apples and made apple x .	up					
23525	Tom gave some x to his grandchildren .	up					
20467	I just bought some x .	up					
19910	There are some strange x in the zoo .	up					
24949	Both roads lead to the x .	up					
22444	There are some things we can change if we only x .	up					
22648	Some people are difficult to x .	up					
17945	Each boy has received his x .	up					
23108	El-Nashar was detained July 14 in Cairo after Britain notified Egyptian authorities that it suspected he may have had links to some of the x .	up					
18340	There are some x in the box .	up					
18668	There are some cookies under the x .	up					
22192	Silence makes some x nervous .	up					
18386	If you need some x , just inquire the higher ranking official .	up					
23484	Tom gave some x to his grandchildren .	up					
21843	I know some of the x .	up					
22216	I put some x in my coffee .	up					
19984	There are some strange x in the zoo .	up					
23737	I have to get some x .	up					
19240	We need to buy some dog x .	up					
24744	Tom ordered some x .	up					
22617	Tom took some artistic x .	up					
22182	After I have had time to give some x to the matter , I will call you .	up					
19006	Tom asked Mary to go to the store to buy some x .	up					
18599	Tom bought a bottle of vodka and some perfume at the duty-free x .	up					
23210	Tom borrowed some x from Mary .	up					
22604	Tom took some artistic x .	up					
22016	I think you need some x .	up					
21174	Tom bought some x for Mary .	up					
18392	If you need some x , just inquire the higher ranking official .	up					
21382	Tom bought some x for Mary .	up					
23956	Tom picked some x and ate them .	up					
20702	Tom bought some apples and made apple x .	up					
18958	You have provided me with some very useful x .	up					
17956	Each boy has received his x .	up					
18826	In the last weeks , there has been x .	up					
18002	I met some x on the mountain .	up					
20897	Tom bought some x for Mary .	up					
22023	I just wish I could have some alone time with x .	up					
20149	There is no rule , but there are some x .	up					
21478	There were some x in the classroom .	up					
24161	Brian took some x .	up					
17964	Every fox praises its x .	up					
24779	Tom ordered some x .	up					
22434	There are some things we can change if we only x .	up					
24008	Tom showed some x to Mary .	up					
20901	Tom bought some x for Mary .	up					
19172	I have some good news to x .	up					
24692	Tom was carrying some shopping~x .	up					
21847	Mr Yamaha gave some x to a beggar .	up					
20037	There was some taste of x in the cake .	up					
23699	I have to get some x .	up					
24229	Brian took some x .	up					
23789	The World~Court has no power to enforce its orders but its decisions have traditionally carried some diplomatic x .	up					
24778	Tom ordered some x .	up					
21292	Tom bought some x for Mary .	up					
24706	Some poems were also written by x .	up					
23236	Your garden needs some x .	up					
21074	Tom bought some x for Mary .	up					
22000	I had some trouble in finding his x .	up					
20428	Tom went to meet some girl named x .	up					
22831	There is no rule but has some x .	up					
23821	Today I had some kipper for x .	up					
19835	My doctor told me that I needed to lose some x .	up					
